{
  "case_id": "IND001",
  "case_label": "IND001 - AVC-101 clean initial IND",
  "scenario_type": "clean",
  "source_records": [
    {
      "record_id": "sponsor_profile",
      "record_type": "sponsor_profile",
      "title": "Sponsor profile extract",
      "source_type": "synthetic_structured_data",
      "fields": {
        "sponsor.legal_name": "AsterVale Therapeutics, Inc.",
        "sponsor.address_line_1": "4100 Meridian Park Drive",
        "sponsor.address_line_2": "Suite 210",
        "sponsor.city": "Raleigh",
        "sponsor.state": "NC",
        "sponsor.postal_code": "27612",
        "sponsor.country": "USA",
        "sponsor.contact_name": "Maya Ellison",
        "sponsor.contact_title": "Vice President, Regulatory Affairs",
        "sponsor.phone": "919-555-0142",
        "sponsor.email": "maya.ellison@astervale.example"
      }
    },
    {
      "record_id": "product_brief",
      "record_type": "investigational_product_brief",
      "title": "Investigational product summary",
      "source_type": "synthetic_structured_data",
      "fields": {
        "product.code_name": "AVC-101",
        "product.generic_name": null,
        "product.dosage_form": "oral capsule",
        "product.route": "oral",
        "product.indication": "recurrent low-grade serous ovarian cancer"
      }
    },
    {
      "record_id": "protocol_synopsis",
      "record_type": "clinical_protocol_synopsis",
      "title": "Protocol AVC101-101 synopsis",
      "source_type": "synthetic_structured_data",
      "fields": {
        "protocol.protocol_number": "AVC101-101",
        "protocol.title": "A Phase 1 Study of AVC-101 in Participants with Recurrent Low-Grade Serous Ovarian Cancer",
        "protocol.phase": "Phase 1",
        "protocol.version": "1.0",
        "protocol.protocol_date": "2026-07-22"
      }
    },
    {
      "record_id": "submission_intake",
      "record_type": "regulatory_submission_intake",
      "title": "Initial IND intake worksheet",
      "source_type": "synthetic_structured_data",
      "fields": {
        "submission.submission_type": "Initial IND",
        "submission.submission_date": "2026-08-18",
        "submission.serial_number": "0000",
        "submission.ind_number": null
      }
    },
    {
      "record_id": "investigator_profile",
      "record_type": "principal_investigator_profile",
      "title": "Principal investigator profile",
      "source_type": "synthetic_structured_data",
      "fields": {
        "investigator.name": "Elena Ward, MD",
        "investigator.institution": "Piedmont Early Phase Research Institute",
        "investigator.address": "88 Trial Center Way, Durham, NC 27710",
        "investigator.phone": "984-555-0177",
        "investigator.email": "elena.ward@piedmont-epri.example"
      }
    },
    {
      "record_id": "investigational_plan",
      "record_type": "general_investigational_plan",
      "title": "General investigational plan worksheet",
      "source_type": "synthetic_structured_data",
      "fields": {
        "plan.rationale": "AVC-101 is an oral small-molecule inhibitor intended to address the limited treatment options for participants with recurrent low-grade serous ovarian cancer, a tumour type that responds poorly to conventional cytotoxic chemotherapy. Nonclinical studies support an acceptable margin between the pharmacologically active exposure and exposures associated with toxicity.",
        "plan.general_approach": "Development will proceed sequentially. A first-in-human dose-escalation study will characterise safety, tolerability and pharmacokinetics and identify a recommended dose. Expansion at that dose will provide a preliminary assessment of antitumour activity before any decision to proceed to a randomised study.",
        "plan.first_year_scope": "One Phase 1 dose-escalation study with a dose-expansion component is planned in the first year following submission. No additional clinical studies are planned during that period.",
        "plan.estimated_enrollment": "Approximately 36 participants (up to 24 in dose escalation and 12 in dose expansion).",
        "plan.anticipated_risks": "Based on repeat-dose toxicology in rat and dog, the anticipated risks of particular severity are reversible hepatocellular injury observed at exposures above the proposed starting dose, and dose-dependent neutropenia. Liver function tests and absolute neutrophil counts are protocol-specified stopping criteria."
      },
      "planned_studies": [
        {
          "study_id": "AVC101-101",
          "title": "A Phase 1 Study of AVC-101 in Participants with Recurrent Low-Grade Serous Ovarian Cancer",
          "objectives": "To determine the safety, tolerability and maximum tolerated dose of oral AVC-101; to characterise single- and multiple-dose pharmacokinetics; to make a preliminary assessment of antitumour activity.",
          "design": "Open-label, single-arm, 3+3 dose escalation followed by dose expansion at the recommended dose.",
          "sample_size": "Up to 36 participants; no formal sample size calculation was performed for this preliminary study.",
          "population": "Adults with histologically confirmed recurrent low-grade serous ovarian cancer who have received at least one prior line of systemic therapy.",
          "parameters": "Safety and tolerability by adverse events, laboratory tests, ECG and physical examination. Pharmacokinetic parameters include Cmax, Tmax and AUC. Antitumour activity assessed by RECIST v1.1.",
          "status": "Protocol submitted with this Initial IND. Enrolment has not started."
        }
      ]
    }
  ],
  "notes": [
    "Golden clean case. Source records agree on all required POC fields."
  ]
}
