{
  "case_id": "IND002",
  "case_label": "IND002 - NLX-204 missing fields",
  "scenario_type": "missing",
  "source_records": [
    {
      "record_id": "sponsor_profile",
      "record_type": "sponsor_profile",
      "title": "Sponsor profile extract",
      "source_type": "synthetic_structured_data",
      "fields": {
        "sponsor.legal_name": "NeuroLumen Biopharma, Inc.",
        "sponsor.address_line_1": "275 Discovery Square",
        "sponsor.address_line_2": null,
        "sponsor.city": "Cambridge",
        "sponsor.state": "MA",
        "sponsor.postal_code": "02139",
        "sponsor.country": "USA",
        "sponsor.contact_name": "Jordan Patel",
        "sponsor.contact_title": null,
        "sponsor.phone": "617-555-0186",
        "sponsor.email": "jordan.patel@neurolumen.example"
      }
    },
    {
      "record_id": "product_brief",
      "record_type": "investigational_product_brief",
      "title": "Investigational product summary",
      "source_type": "synthetic_structured_data",
      "fields": {
        "product.code_name": "NLX-204",
        "product.generic_name": null,
        "product.dosage_form": "intravenous solution",
        "product.route": "intravenous",
        "product.indication": "acute ischemic stroke"
      }
    },
    {
      "record_id": "protocol_synopsis",
      "record_type": "clinical_protocol_synopsis",
      "title": "Protocol NLX204-101 synopsis",
      "source_type": "synthetic_structured_data",
      "fields": {
        "protocol.protocol_number": "NLX204-101",
        "protocol.title": "A Phase 1b Study of NLX-204 in Adults with Recent Acute Ischemic Stroke",
        "protocol.phase": "Phase 1b",
        "protocol.version": "0.9",
        "protocol.protocol_date": null
      }
    },
    {
      "record_id": "submission_intake",
      "record_type": "regulatory_submission_intake",
      "title": "Initial IND intake worksheet",
      "source_type": "synthetic_structured_data",
      "fields": {
        "submission.submission_type": "Initial IND",
        "submission.submission_date": "2026-08-18",
        "submission.serial_number": "0000",
        "submission.ind_number": null
      }
    },
    {
      "record_id": "investigator_profile",
      "record_type": "principal_investigator_profile",
      "title": "Principal investigator profile",
      "source_type": "synthetic_structured_data",
      "fields": {
        "investigator.name": "Lena Brooks, MD",
        "investigator.institution": "Harborview Translational Research Center",
        "investigator.address": "144 Beacon Research Road, Boston, MA 02215",
        "investigator.phone": "857-555-0108",
        "investigator.email": null
      }
    }
  ],
  "notes": [
    "Golden missing case. Contact title, protocol date, and investigator email are unavailable in source records."
  ]
}
