{
  "case_id": "IND005",
  "case_label": "IND005 - CNV-512 clean initial IND",
  "scenario_type": "clean",
  "source_records": [
    {
      "record_id": "sponsor_profile",
      "record_type": "sponsor_profile",
      "title": "Sponsor profile extract",
      "source_type": "synthetic_structured_data",
      "fields": {
        "sponsor.legal_name": "CardioNova Therapeutics Incorporated",
        "sponsor.address_line_1": "1500 Signal Hill Road",
        "sponsor.address_line_2": null,
        "sponsor.city": "Austin",
        "sponsor.state": "TX",
        "sponsor.postal_code": "78701",
        "sponsor.country": "USA",
        "sponsor.contact_name": "Rebecca Lin",
        "sponsor.contact_title": "Executive Director, Regulatory Affairs",
        "sponsor.phone": "512-555-0163",
        "sponsor.email": "rebecca.lin@cardionova.example"
      }
    },
    {
      "record_id": "product_brief",
      "record_type": "investigational_product_brief",
      "title": "Investigational product summary",
      "source_type": "synthetic_structured_data",
      "fields": {
        "product.code_name": "CNV-512",
        "product.generic_name": "fictionalmycin",
        "product.dosage_form": "sterile injectable solution",
        "product.route": "intravenous infusion",
        "product.indication": "heart failure with preserved ejection fraction"
      }
    },
    {
      "record_id": "protocol_synopsis",
      "record_type": "clinical_protocol_synopsis",
      "title": "Protocol CNV512-102 synopsis",
      "source_type": "synthetic_structured_data",
      "fields": {
        "protocol.protocol_number": "CNV512-102",
        "protocol.title": "A Phase 2a Study of CNV-512 in Adults with Heart Failure with Preserved Ejection Fraction",
        "protocol.phase": "Phase 2a",
        "protocol.version": "1.0",
        "protocol.protocol_date": "2026-07-05"
      }
    },
    {
      "record_id": "submission_intake",
      "record_type": "regulatory_submission_intake",
      "title": "Initial IND intake worksheet",
      "source_type": "synthetic_structured_data",
      "fields": {
        "submission.submission_type": "Initial IND",
        "submission.submission_date": "2026-08-18",
        "submission.serial_number": "0000",
        "submission.ind_number": null
      }
    },
    {
      "record_id": "investigator_profile",
      "record_type": "principal_investigator_profile",
      "title": "Principal investigator profile",
      "source_type": "synthetic_structured_data",
      "fields": {
        "investigator.name": "Samuel Ortiz, MD",
        "investigator.institution": "Central Texas Cardiometabolic Research Center",
        "investigator.address": "55 Heartland Plaza, Austin, TX 78712",
        "investigator.phone": "512-555-0116",
        "investigator.email": "samuel.ortiz@ctcrc.example"
      }
    },
    {
      "record_id": "investigational_plan",
      "record_type": "general_investigational_plan",
      "title": "General investigational plan worksheet",
      "source_type": "synthetic_structured_data",
      "fields": {
        "plan.rationale": "CNV-512 is an intravenous agent intended to improve exercise capacity in heart failure with preserved ejection fraction, a condition with no approved disease-modifying therapy. A prior Phase 1 study in healthy volunteers established tolerability across the dose range now proposed.",
        "plan.general_approach": "Development moves directly to a Phase 2a study in the target population, using exercise capacity and haemodynamic endpoints to establish proof of mechanism before a larger efficacy study is designed.",
        "plan.first_year_scope": "One Phase 2a study in adults with heart failure with preserved ejection fraction is planned in the first year following submission.",
        "plan.estimated_enrollment": "Approximately 60 participants randomised across two dose levels and placebo.",
        "plan.anticipated_risks": "Anticipated risks of particular severity are symptomatic hypotension during and shortly after infusion, and renal function decline observed at supratherapeutic exposures in the 26-week rat study. Blood pressure is monitored throughout infusion and creatinine is a protocol-specified stopping criterion."
      },
      "planned_studies": [
        {
          "study_id": "CNV512-102",
          "title": "A Phase 2a Study of CNV-512 in Adults with Heart Failure with Preserved Ejection Fraction",
          "objectives": "To assess the effect of CNV-512 on exercise capacity and to evaluate safety and tolerability in the target population.",
          "design": "Randomised, double-blind, placebo-controlled, parallel-group study with two active dose levels.",
          "sample_size": "Approximately 60 participants, 20 per arm.",
          "population": "Adults with heart failure with preserved ejection fraction, NYHA class II to III, with an ejection fraction of at least 50 percent.",
          "parameters": "Primary endpoint is change in six-minute walk distance. Safety assessed by adverse events, blood pressure, renal function and ECG.",
          "status": "Protocol submitted with this Initial IND. Enrolment has not started."
        }
      ]
    }
  ],
  "notes": [
    "Clean case with fictional generic name included."
  ]
}
