{
  "case_id": "IND006",
  "case_label": "IND006 - GF-088 clean initial IND",
  "scenario_type": "clean",
  "source_records": [
    {
      "record_id": "sponsor_profile",
      "record_type": "sponsor_profile",
      "title": "Sponsor profile extract",
      "source_type": "synthetic_structured_data",
      "fields": {
        "sponsor.legal_name": "GlycanForge Bio, Inc.",
        "sponsor.address_line_1": "2400 Catalyst Avenue",
        "sponsor.address_line_2": "Suite 500",
        "sponsor.city": "Seattle",
        "sponsor.state": "WA",
        "sponsor.postal_code": "98109",
        "sponsor.country": "USA",
        "sponsor.contact_name": "Owen Carlisle",
        "sponsor.contact_title": "Senior Vice President, Regulatory and Quality",
        "sponsor.phone": "206-555-0134",
        "sponsor.email": "owen.carlisle@glycanforge.example"
      }
    },
    {
      "record_id": "product_brief",
      "record_type": "investigational_product_brief",
      "title": "Investigational product summary",
      "source_type": "synthetic_structured_data",
      "fields": {
        "product.code_name": "GF-088",
        "product.generic_name": null,
        "product.dosage_form": "prefilled syringe",
        "product.route": "subcutaneous",
        "product.indication": "moderate-to-severe atopic dermatitis"
      }
    },
    {
      "record_id": "protocol_synopsis",
      "record_type": "clinical_protocol_synopsis",
      "title": "Protocol GF088-101 synopsis",
      "source_type": "synthetic_structured_data",
      "fields": {
        "protocol.protocol_number": "GF088-101",
        "protocol.title": "A Phase 1 Randomized Study of GF-088 in Healthy Adult Participants",
        "protocol.phase": "Phase 1",
        "protocol.version": "1.0",
        "protocol.protocol_date": "2026-07-11"
      }
    },
    {
      "record_id": "submission_intake",
      "record_type": "regulatory_submission_intake",
      "title": "Initial IND intake worksheet",
      "source_type": "synthetic_structured_data",
      "fields": {
        "submission.submission_type": "Initial IND",
        "submission.submission_date": "2026-08-18",
        "submission.serial_number": "0000",
        "submission.ind_number": null
      }
    },
    {
      "record_id": "investigator_profile",
      "record_type": "principal_investigator_profile",
      "title": "Principal investigator profile",
      "source_type": "synthetic_structured_data",
      "fields": {
        "investigator.name": "Rachel Imani, MD",
        "investigator.institution": "Northwest Dermatology Clinical Research",
        "investigator.address": "700 Trial Works Street, Seattle, WA 98195",
        "investigator.phone": "206-555-0197",
        "investigator.email": "rachel.imani@nwdcr.example"
      }
    },
    {
      "record_id": "investigational_plan",
      "record_type": "general_investigational_plan",
      "title": "General investigational plan worksheet",
      "source_type": "synthetic_structured_data",
      "fields": {
        "plan.rationale": "GF-088 is a subcutaneously administered biologic intended for moderate-to-severe atopic dermatitis in participants inadequately controlled on topical therapy.",
        "plan.general_approach": "A first-in-human study in healthy adults will establish safety, tolerability and pharmacokinetics before evaluation in participants with atopic dermatitis.",
        "plan.first_year_scope": "One Phase 1 study in healthy adult participants is planned in the first year following submission.",
        "plan.estimated_enrollment": "Approximately 40 healthy adult participants."
      }
    }
  ],
  "notes": [
    "Clean case with subcutaneous biologic-style product."
  ]
}
