{
  "case_id": "IND010",
  "case_label": "IND010 - KR-7.5 XR unusual formatting",
  "scenario_type": "unusual_formatting",
  "source_records": [
    {
      "record_id": "sponsor_profile",
      "record_type": "sponsor_profile",
      "title": "Sponsor profile extract",
      "source_type": "synthetic_structured_data",
      "fields": {
        "sponsor.legal_name": "Koru-7 BioWorks, L.L.C.",
        "sponsor.address_line_1": "7 North Foundry Row",
        "sponsor.address_line_2": "Mailbox REG-IND-010",
        "sponsor.city": "New Haven",
        "sponsor.state": "CT",
        "sponsor.postal_code": "06510",
        "sponsor.country": "USA",
        "sponsor.contact_name": "A. Morgan Vale",
        "sponsor.contact_title": "Regulatory Lead, IND Programs",
        "sponsor.phone": "203-555-0107",
        "sponsor.email": "regulatory.kr7@koru7-bioworks.example"
      }
    },
    {
      "record_id": "product_brief",
      "record_type": "investigational_product_brief",
      "title": "Investigational product summary",
      "source_type": "synthetic_structured_data",
      "fields": {
        "product.code_name": "KR-7.5 XR",
        "product.generic_name": null,
        "product.dosage_form": "extended-release oral tablet",
        "product.route": "oral",
        "product.indication": "treatment-resistant fictional neuropathic pain"
      }
    },
    {
      "record_id": "protocol_synopsis",
      "record_type": "clinical_protocol_synopsis",
      "title": "Protocol KR7-01A/US synopsis",
      "source_type": "synthetic_structured_data",
      "fields": {
        "protocol.protocol_number": "KR7-01A/US",
        "protocol.title": "A Phase 1, First-in-Human Study of KR-7.5 XR in Healthy Adult Participants",
        "protocol.phase": "Phase 1",
        "protocol.version": "v1.0-FIH",
        "protocol.protocol_date": "2026-07-27"
      }
    },
    {
      "record_id": "submission_intake",
      "record_type": "regulatory_submission_intake",
      "title": "Initial IND intake worksheet",
      "source_type": "synthetic_structured_data",
      "fields": {
        "submission.submission_type": "Initial IND",
        "submission.submission_date": "2026-08-18",
        "submission.serial_number": "0000",
        "submission.ind_number": null
      }
    },
    {
      "record_id": "investigator_profile",
      "record_type": "principal_investigator_profile",
      "title": "Principal investigator profile",
      "source_type": "synthetic_structured_data",
      "fields": {
        "investigator.name": "Miles Grant, MD",
        "investigator.institution": "Elm City Clinical Pharmacology Unit",
        "investigator.address": "19 Phase One Lane, New Haven, CT 06511",
        "investigator.phone": "203-555-0199",
        "investigator.email": "miles.grant@eccpu.example"
      }
    }
  ],
  "notes": [
    "Unusual formatting case with punctuation-heavy sponsor name, product code, and protocol number."
  ]
}
