{
  "case_id": "IND009",
  "case_label": "IND009 - IMR-604 product conflict",
  "scenario_type": "conflict",
  "source_records": [
    {
      "record_id": "sponsor_profile",
      "record_type": "sponsor_profile",
      "title": "Sponsor profile extract",
      "source_type": "synthetic_structured_data",
      "fields": {
        "sponsor.legal_name": "ImmunoRidge Therapeutics, Inc.",
        "sponsor.address_line_1": "1800 Ridgeview Biopark",
        "sponsor.address_line_2": null,
        "sponsor.city": "Boulder",
        "sponsor.state": "CO",
        "sponsor.postal_code": "80302",
        "sponsor.country": "USA",
        "sponsor.contact_name": "Daniel Foster",
        "sponsor.contact_title": "Chief Regulatory Officer",
        "sponsor.phone": "303-555-0112",
        "sponsor.email": "daniel.foster@immunoridge.example"
      }
    },
    {
      "record_id": "product_brief",
      "record_type": "investigational_product_brief",
      "title": "Investigational product summary",
      "source_type": "synthetic_structured_data",
      "fields": {
        "product.code_name": "IMR-604",
        "product.generic_name": null,
        "product.dosage_form": "lyophilized powder for injection",
        "product.route": "intramuscular",
        "product.indication": "moderate-to-severe fictional autoimmune arthritis"
      }
    },
    {
      "record_id": "cmc_summary",
      "record_type": "cmc_summary_extract",
      "title": "CMC summary extract",
      "source_type": "synthetic_structured_data",
      "fields": {
        "product.route": "subcutaneous",
        "product.dosage_form": "solution for injection"
      }
    },
    {
      "record_id": "protocol_synopsis",
      "record_type": "clinical_protocol_synopsis",
      "title": "Protocol IMR604-101 synopsis",
      "source_type": "synthetic_structured_data",
      "fields": {
        "protocol.protocol_number": "IMR604-101",
        "protocol.title": "A Phase 1 Study of IMR-604 in Healthy Adult Participants",
        "protocol.phase": "Phase 1",
        "protocol.version": "1.0",
        "protocol.protocol_date": "2026-07-13"
      }
    },
    {
      "record_id": "submission_intake",
      "record_type": "regulatory_submission_intake",
      "title": "Initial IND intake worksheet",
      "source_type": "synthetic_structured_data",
      "fields": {
        "submission.submission_type": "Initial IND",
        "submission.submission_date": "2026-08-18",
        "submission.serial_number": "0000",
        "submission.ind_number": null
      }
    },
    {
      "record_id": "investigator_profile",
      "record_type": "principal_investigator_profile",
      "title": "Principal investigator profile",
      "source_type": "synthetic_structured_data",
      "fields": {
        "investigator.name": "Amira Shah, MD",
        "investigator.institution": "Front Range Phase 1 Research Clinic",
        "investigator.address": "210 Trial Mesa Drive, Boulder, CO 80303",
        "investigator.phone": "720-555-0183",
        "investigator.email": "amira.shah@frp1.example"
      }
    }
  ],
  "notes": [
    "Conflict case with inconsistent product route and dosage form across simulated source records."
  ]
}
